{"$schema":"https://json-schema.org/draft/2020-12/schema","title":"Flock controlled audio inputs v1","type":"object","additionalProperties":false,"required":["schemaVersion","provenanceKind","vendor","baseImages","geometry","artifacts"],"properties":{"schemaVersion":{"const":1},"provenanceKind":{"const":"controlled-artifact"},"vendor":{"type":"object"},"baseImages":{"type":"object"},"geometry":{"type":"object"},"artifacts":{"type":"array","minItems":5}}}
