{"artifacts":[{"byteCount":36,"kind":"vendor","logicalPath":"vendor/file.py","mountPath":"vendor/file.py","sha256":"f32944d8aec7549a8f0eaa6a7bf2448f896c66d9cd4f100984cd10b313e5b328","sourcePath":"/fixture/vendor/file.py"},{"byteCount":25,"kind":"weight","logicalPath":"weights/model.bin","mountPath":"weights/model.bin","sha256":"97d4195ce86bcaf495c75d1b8377294e3d989aaf84fd7f543f719f82399cc717","sourcePath":"/fixture/weights/model.bin"},{"byteCount":33,"kind":"voice-map","logicalPath":"maps/voice-map.json","mountPath":"maps/voice-map.json","sha256":"15b45ee6be348b763bf41c06b332a3ee291598266fe7daccca0c08d7b722ed1b","sourcePath":"/fixture/maps/voice-map.json"},{"byteCount":13,"kind":"calibration","logicalPath":"calibration/output.json","mountPath":"calibration/output.json","sha256":"7a0c218cb736e80092db14b914d5befc0f56a7ed5246a7f56c555bfbf9f0828b","sourcePath":"/fixture/calibration/output.json"},{"byteCount":24,"kind":"audio","logicalPath":"audio/amen.wav","mountPath":"audio/amen.wav","sha256":"19146956dffb65c0bf4bdf1502b6138132b0d0add81e0941801f4647ae309217","sourcePath":"/fixture/audio/amen.wav"},{"byteCount":26,"kind":"audio","logicalPath":"audio/forest.wav","mountPath":"audio/forest.wav","sha256":"29b299f4fa088822312a9b44388eaab74b63a62ec1dfc6797dfa71692a24f9a2","sourcePath":"/fixture/audio/forest.wav"}],"baseImages":{"audio":{"digest":"sha256:3333333333333333333333333333333333333333333333333333333333333333","imageDigest":"sha256:4444444444444444444444444444444444444444444444444444444444444444","repository":"fixture/audio"},"runtime":{"digest":"sha256:1111111111111111111111111111111111111111111111111111111111111111","imageDigest":"sha256:2222222222222222222222222222222222222222222222222222222222222222","repository":"fixture/runtime"}},"geometry":{"blockFrames":4096,"poolSize":5,"rowVoices":["bass","pad","lead","pluck","pad"],"sampleRate":44100},"provenanceKind":"controlled-artifact","schemaVersion":1,"vendor":{"artifactByteCount":35,"artifactPath":"/fixture/vendor/upstream.tar","artifactSha256":"80914e5afe6c6932b360b84ddbc19a283bb1786c4a4677099088a5d2805fa00f","provenanceKind":"controlled-artifact","treeSha256":"049e87d64ed0f20476a02d0329096fe23863beca99ca63efcf4dfb47ec4b5bd3"}}
